{
  "schemaVersion": 1,
  "exportedAt": "2026-08-30T10:00:00.000Z",
  "generator": {
    "name": "GenViet",
    "version": "0.1.0"
  },
  "tree": {
    "name": "Cây Tampered Reference"
  },
  "persons": [
    {
      "sourceId": "11111111-1111-4111-a111-111111111111",
      "fullName": "Người A",
      "gender": "male",
      "livingStatus": "living"
    },
    {
      "sourceId": "22222222-2222-4222-a222-222222222222",
      "fullName": "Người B",
      "gender": "female",
      "livingStatus": "living"
    }
  ],
  "parentChildRelationships": [
    {
      "sourceId": "33333333-3333-4333-a333-333333333333",
      "parentId": "11111111-1111-4111-a111-111111111111",
      "childId": "22222222-2222-4222-a222-222222222222",
      "parentRole": "father",
      "relationshipKind": "biological"
    },
    {
      "sourceId": "44444444-4444-4444-a444-444444444444",
      "parentId": "22222222-2222-4222-a222-222222222222",
      "childId": "11111111-1111-4111-a111-111111111111",
      "parentRole": "mother",
      "relationshipKind": "biological"
    }
  ],
  "unions": [],
  "unionMembers": [],
  "mediaMetadata": [],
  "manifest": {
    "personCount": 2,
    "relationshipCount": 2,
    "unionCount": 0,
    "mediaCount": 0
  }
}
