{
  "schemaVersion": 1,
  "exportedAt": "2026-08-30T10:00:00.000Z",
  "generator": {
    "name": "GenViet",
    "version": "0.1.0"
  },
  "tree": {
    "name": "Cây Injected Token"
  },
  "persons": [
    {
      "sourceId": "11111111-1111-4111-a111-111111111111",
      "fullName": "Người A",
      "gender": "male",
      "livingStatus": "living",
      "biography": "Chứa access_token=eyJhbGciOiJIUzI1NiIsInR5cCI6IkpXVCJ9 trong tiểu sử"
    }
  ],
  "parentChildRelationships": [],
  "unions": [],
  "unionMembers": [],
  "mediaMetadata": [],
  "manifest": {
    "personCount": 1,
    "relationshipCount": 0,
    "unionCount": 0,
    "mediaCount": 0
  }
}
