{
  "schemaVersion": 1,
  "exportedAt": "2026-08-30T10:00:00.000Z",
  "generator": {
    "name": "GenViet",
    "version": "0.1.0"
  },
  "tree": {
    "sourceId": "11111111-1111-4111-a111-111111111111",
    "name": "Dòng họ Nguyễn Phúc",
    "description": "Gia phả thử nghiệm xuất nhập sao lưu",
    "privacyLevel": "private",
    "generationAnchorPersonId": "22222222-2222-4222-a222-222222222222",
    "defaultPersonId": "22222222-2222-4222-a222-222222222222"
  },
  "persons": [
    {
      "sourceId": "22222222-2222-4222-a222-222222222222",
      "fullName": "Nguyễn Phúc Cụ Tổ",
      "gender": "male",
      "livingStatus": "deceased",
      "birthYear": 1900,
      "birthDatePrecision": "year",
      "birthIsEstimated": false,
      "deathYear": 1980,
      "deathDatePrecision": "year",
      "deathIsEstimated": false,
      "hometownText": "Huế",
      "verificationStatus": "verified"
    },
    {
      "sourceId": "33333333-3333-4333-a333-333333333333",
      "fullName": "Trần Thị Cụ Bà",
      "gender": "female",
      "livingStatus": "deceased",
      "birthYear": 1905,
      "birthDatePrecision": "year",
      "birthIsEstimated": false,
      "deathYear": 1985,
      "deathDatePrecision": "year",
      "deathIsEstimated": false,
      "hometownText": "Huế",
      "verificationStatus": "verified"
    },
    {
      "sourceId": "44444444-4444-4444-a444-444444444444",
      "fullName": "Nguyễn Phúc Trưởng Nam",
      "gender": "male",
      "livingStatus": "living",
      "birthYear": 1940,
      "birthDatePrecision": "year",
      "birthIsEstimated": false,
      "verificationStatus": "verified"
    }
  ],
  "parentChildRelationships": [
    {
      "sourceId": "55555555-5555-4555-a555-555555555555",
      "parentId": "22222222-2222-4222-a222-222222222222",
      "childId": "44444444-4444-4444-a444-444444444444",
      "parentRole": "father",
      "relationshipKind": "biological",
      "verificationStatus": "verified"
    },
    {
      "sourceId": "66666666-6666-4666-a666-666666666666",
      "parentId": "33333333-3333-4333-a333-333333333333",
      "childId": "44444444-4444-4444-a444-444444444444",
      "parentRole": "mother",
      "relationshipKind": "biological",
      "verificationStatus": "verified"
    }
  ],
  "unions": [
    {
      "sourceId": "77777777-7777-4777-a777-777777777777",
      "status": "active",
      "startYear": 1925,
      "startDatePrecision": "year",
      "startIsEstimated": false,
      "verificationStatus": "verified"
    }
  ],
  "unionMembers": [
    {
      "sourceId": "88888888-8888-4888-a888-888888888888",
      "unionId": "77777777-7777-4777-a777-777777777777",
      "personId": "22222222-2222-4222-a222-222222222222",
      "memberRole": "spouse"
    },
    {
      "sourceId": "99999999-9999-4999-a999-999999999999",
      "unionId": "77777777-7777-4777-a777-777777777777",
      "personId": "33333333-3333-4333-a333-333333333333",
      "memberRole": "spouse"
    }
  ],
  "mediaMetadata": [
    {
      "sourceId": "aaaaaaaa-aaaa-4aaa-aaaa-aaaaaaaaaaaa",
      "personId": "22222222-2222-4222-a222-222222222222",
      "mimeType": "image/webp",
      "fileSizeBytes": 10240,
      "binaryIncluded": false,
      "availability": "metadata_only"
    }
  ],
  "manifest": {
    "personCount": 3,
    "relationshipCount": 2,
    "unionCount": 1,
    "mediaCount": 1
  }
}
